{
  "schema_version": "m4cil-fixtures/v1",
  "status": "PROPOSED_PENDING_MEASUREMENT",
  "profile_id": "flrh-m4cil-single-effect-incremental-reference/1",
  "replay_modes": ["happy", "crash_after_external_success"],
  "expected": {
    "status": "SLICE_CONFORMED",
    "outer_fsm_stop_state": "HONOR_PENDING_INTERRUPT",
    "trace_claim": "FSM_CONFORMANCE_PROJECTION_ONLY",
    "outer_reducer_executed": false,
    "durable_run_status": "active",
    "bootstrap_logical_time": 1,
    "reuse_logical_time": 2,
    "minimum_candidate_cache_hits": 1,
    "executed_candidate_body_evaluations": 0,
    "public_m2_solve_calls_per_incremental_step": 2,
    "intent_count": 1,
    "receipt_count": 1,
    "pending_count": 0,
    "happy_apply_count": 1,
    "happy_query_count": 0,
    "crash_apply_count": 1,
    "crash_query_count": 1,
    "mutation_count": 1,
    "crash_process_model": "subprocess_os_exit_reopen",
    "crash_worker_exit_code": 86
  },
  "sensitivity_cases": [
    "bootstrap-checkpoint-digest",
    "reuse-prior-checkpoint-digest",
    "reuse-cache-hit-accounting",
    "reuse-body-evaluation-accounting",
    "final-fixpoint-digest",
    "lr-fixpoint-binding",
    "accepted-event-logical-time",
    "bootstrap-delta-causation",
    "r-frontier-logical-time",
    "h-intent-proposal-id",
    "durable-checkpoint-logic-lineage",
    "receipt-input-root-binding",
    "action-receipt-intent-id",
    "durable-pending-count",
    "fsm-trace-event",
    "crash-worker-payload-digest"
  ],
  "non_claims": [
    "outer FSM SUCCEEDED or full run completion",
    "general persistent incremental runtime",
    "filesystem or database persistence for L checkpoints",
    "reduced total runtime or performance superiority",
    "multi-event or multi-effect scheduling",
    "durable R state",
    "real destination safety or exactly-once delivery",
    "integrated production runtime",
    "engine promotion",
    "comparative efficacy or Lakatos progress"
  ]
}
